{
  "metadata": {
    "title": "Architecture CRUD Application",
    "system": "Architecture Management System",
    "version": "1.0.0",
    "date": "2025-05-10"
  },
  "adrs": {
    "ADR-001": {
      "id": "ADR-001",
      "title": "Use FastAPI for Backend",
      "status": "accepted",
      "date": "2024-01-15",
      "authors": [
        "John Smith",
        "Jane Doe"
      ],
      "context": "We need to choose a web framework for our backend API that supports modern Python features, has good performance, and provides automatic API documentation.",
      "decision": "We will use FastAPI as our backend framework.",
      "alternatives": {
        "Flask": {
          "pros": [
            "Simple and lightweight",
            "Large ecosystem",
            "Well-documented"
          ],
          "cons": [
            "No built-in async support",
            "Manual OpenAPI documentation",
            "Less type safety"
          ]
        },
        "Django": {
          "pros": [
            "Full-featured",
            "Built-in admin",
            "ORM included"
          ],
          "cons": [
            "Heavyweight for API-only apps",
            "Steeper learning curve",
            "Less suitable for microservices"
          ]
        }
      },
      "relationships": {
        "qualities": [
          {
            "id": "QA-001",
            "type": "addresses",
            "strength": "medium"
          }
        ],
        "risks": [
          {
            "id": "RISK-001",
            "type": "mitigates",
            "impact": "medium"
          }
        ],
        "technicalDebts": [],
        "components": [
          {
            "id": "COMP-001",
            "type": "implements",
            "responsibility": "primary"
          }
        ],
        "relatedAdrs": []
      }
    },
    "ADR-002": {
      "id": "ADR-002",
      "title": "Use Streamlit for UI",
      "status": "accepted",
      "date": "2024-01-20",
      "authors": [
        "Jane Doe"
      ],
      "context": "We need a rapid UI development framework that integrates well with Python and doesn't require extensive frontend knowledge.",
      "decision": "We will use Streamlit for the user interface.",
      "alternatives": {
        "React": {
          "pros": [
            "Highly flexible",
            "Large ecosystem",
            "Industry standard"
          ],
          "cons": [
            "Requires separate frontend stack",
            "Longer development time",
            "Need JavaScript expertise"
          ]
        },
        "Dash": {
          "pros": [
            "Python-based",
            "Good for data apps",
            "Plotly integration"
          ],
          "cons": [
            "Steeper learning curve",
            "Less intuitive than Streamlit",
            "More complex layouts"
          ]
        }
      },
      "relationships": {
        "qualities": [
          {
            "id": "QA-002",
            "type": "addresses",
            "strength": "medium"
          }
        ],
        "risks": [],
        "technicalDebts": [
          {
            "id": "TD-001",
            "type": "causes",
            "impact": "medium"
          }
        ],
        "components": [
          {
            "id": "COMP-002",
            "type": "implements",
            "responsibility": "primary"
          }
        ],
        "relatedAdrs": []
      }
    }
  },
  "qualities": {
    "QR-001": {
      "id": "QR-001",
      "title": "High Performance",
      "description": "The system should respond to API requests within 200ms for 95% of requests under normal load.",
      "metrics": [
        {
          "name": "Response Time",
          "target": "200",
          "measure": "ms"
        },
        {
          "name": "Throughput",
          "target": "1000",
          "measure": "requests/second"
        }
      ],
      "priority": "high"
    },
    "QR-002": {
      "id": "QR-002",
      "title": "Rapid Development",
      "description": "New features should be implementable within days, not weeks. The UI should be easy to modify and extend.",
      "metrics": [
        {
          "name": "Feature Development Time",
          "target": "3",
          "measure": "days"
        }
      ],
      "priority": "medium"
    },
    "QR-003": {
      "id": "QR-003",
      "title": "Security",
      "description": "The system must protect against common web vulnerabilities and ensure data integrity.",
      "metrics": [
        {
          "name": "Security Score",
          "target": "A",
          "measure": "grade"
        }
      ],
      "priority": "high"
    }
  },
  "risks": {
    "RISK-001": {
      "id": "RISK-001",
      "title": "Limited FastAPI Expertise",
      "description": "The team has limited experience with FastAPI, which may lead to implementation challenges.",
      "impact": "medium",
      "likelihood": "high",
      "mitigationStrategy": "Provide team training, establish code review process, create coding standards",
      "status": "identified",
      "probability": "high"
    },
    "RISK-002": {
      "id": "RISK-002",
      "title": "Streamlit Scalability",
      "description": "Streamlit may not scale well for large numbers of concurrent users.",
      "impact": "high",
      "likelihood": "medium",
      "mitigationStrategy": "Monitor usage patterns, implement caching, consider alternative UI if needed",
      "status": "identified",
      "probability": "medium"
    }
  },
  "technicalDebts": {
    "TD-001": {
      "id": "TD-001",
      "title": "Limited UI Customization",
      "description": "Streamlit provides limited customization options compared to traditional web frameworks.",
      "impact": "medium",
      "effort": "high",
      "remediationPlan": "If custom UI requirements increase, migrate to React-based frontend",
      "status": "identified"
    },
    "TD-002": {
      "id": "TD-002",
      "title": "JSON File Storage",
      "description": "Using JSON files for data storage limits scalability and concurrent access.",
      "impact": "high",
      "effort": "medium",
      "remediationPlan": "Implement database backend (PostgreSQL) when user base grows",
      "status": "identified"
    }
  },
  "components": {
    "C-001": {
      "id": "C-001",
      "title": "API Backend",
      "responsibility": "Handle all business logic, data validation, and persistence",
      "interfaces": [
        {
          "name": "REST API endpoints",
          "description": "",
          "type": "provided"
        },
        {
          "name": "OpenAPI documentation",
          "description": "",
          "type": "provided"
        },
        {
          "name": "JSON data format",
          "description": "",
          "type": "provided"
        }
      ],
      "attributes": {
        "framework": "FastAPI",
        "language": "Python 3.11",
        "deployment": "Docker container"
      }
    },
    "C-002": {
      "id": "C-002",
      "title": "Web UI",
      "responsibility": "Provide user interface for CRUD operations and data visualization",
      "interfaces": [
        {
          "name": "HTTP client to API",
          "description": "",
          "type": "provided"
        },
        {
          "name": "Web browser interface",
          "description": "",
          "type": "provided"
        }
      ],
      "attributes": {
        "framework": "Streamlit",
        "language": "Python 3.11",
        "deployment": "Docker container"
      }
    },
    "C-003": {
      "id": "C-003",
      "title": "Data Layer",
      "responsibility": "Manage data persistence and validation",
      "interfaces": [
        {
          "name": "Repository pattern",
          "description": "",
          "type": "provided"
        },
        {
          "name": "JSON schema validation",
          "description": "",
          "type": "provided"
        }
      ],
      "attributes": {
        "storage": "JSON files",
        "validation": "Pydantic models"
      }
    }
  }
}